{
  "schemaId": "xhs.tcb.manifest.v1",
  "schemaVersion": 1,
  "manifestId": "xw.m6-grounded-run.tcb.v1",
  "implementationClosureHash": "dc96c6f4b13970cad957e34815d983be78927295f6f33593ff528561d29c3e4d",
  "contentHashProfile": "xhs.m6-grounded-run-capability-self-binding.v1",
  "paths": [
    "artifacts/m6-4/cohort-manifests/m6_4_action_smoke.json",
    "artifacts/m6-4/cohort-manifests/m6_4_hot_close.json",
    "artifacts/m6-4/cohort-manifests/m6_4_reliability.json",
    "artifacts/m6-4/cohort-manifests/m6_4_shadow.json",
    "artifacts/m6-4/cohort-manifests/m6_4_smooth.json",
    "artifacts/m6-4/cohort-manifests/xw.m6-effect-boundary.v1.json",
    "config/runtime/xw-runtime.v1.json",
    "integrations/dsh-xw/lock.json",
    "integrations/dsh-xw/package-lock.json",
    "integrations/dsh-xw/package.json",
    "integrations/dsh-xw/profiles/live/cordis.patch.yml",
    "integrations/dsh-xw/profiles/live/cordis.yml",
    "integrations/dsh-xw/profiles/live/model-manifest.json",
    "integrations/dsh-xw/profiles/live/package.json",
    "integrations/dsh-xw/src/canonical-json.mjs",
    "integrations/dsh-xw/src/constants.mjs",
    "integrations/dsh-xw/src/errors.mjs",
    "integrations/dsh-xw/src/live-model-profile.mjs",
    "integrations/dsh-xw/src/live-network-guard.mjs",
    "integrations/dsh-xw/src/live-parent-broker.mjs",
    "integrations/dsh-xw/src/live-pipe-client.mjs",
    "integrations/dsh-xw/src/live-process-adapter.mjs",
    "integrations/dsh-xw/src/live-runtime-dependency-layer.mjs",
    "integrations/dsh-xw/src/live-runtime-plugin.mjs",
    "integrations/dsh-xw/src/live-tools.mjs",
    "integrations/dsh-xw/src/live-worker-driver.mjs",
    "integrations/dsh-xw/src/stdio-supervisor.mjs",
    "integrations/dsh-xw/src/xw-protocol-server.mjs",
    "packages/harness-protocol/lib/trace-store.mjs",
    "packages/harness-protocol/locks/dsh.lock.v1.json",
    "packages/kernel/contracts/open-action/action-request.v1.schema.json",
    "packages/kernel/contracts/open-action/action-result.v1.schema.json",
    "packages/kernel/contracts/open-action/observation.v1.schema.json",
    "packages/kernel/contracts/open-action/primitive-action.v1.schema.json",
    "packages/kernel/contracts/orchestration/m6/xw.capture-attempt-receipt.v1.schema.json",
    "packages/kernel/contracts/orchestration/m6/xw.m6-4-cohort-manifest.v1.schema.json",
    "packages/kernel/contracts/orchestration/m6/xw.m6-4-live-window-authorization.v1.schema.json",
    "packages/kernel/contracts/orchestration/m6/xw.m6-4-production-dependency-binding.v1.schema.json",
    "packages/kernel/contracts/orchestration/m6/xw.m6-action-slot-spec.v1.schema.json",
    "packages/kernel/contracts/orchestration/m6/xw.m6-effect-boundary.v1.schema.json",
    "packages/kernel/contracts/orchestration/m6/xw.m6-gate-f-artifact-catalog.v1.schema.json",
    "packages/kernel/contracts/orchestration/m6/xw.m6-live-gate.v1.schema.json",
    "packages/kernel/contracts/orchestration/m6/xw.m6-live-gate.v2.schema.json",
    "packages/kernel/contracts/orchestration/m6/xw.m6-locks.v2.schema.json",
    "packages/kernel/contracts/orchestration/m6/xw.m6-target-environment-attestation.v1.schema.json",
    "packages/kernel/contracts/runtime-profile.v1.json",
    "packages/kernel/lib/m6-4-cohort.mjs",
    "packages/kernel/lib/m6-4-live-window-authorization.mjs",
    "packages/kernel/lib/m6-action-slot.mjs",
    "packages/kernel/lib/m6-aggregate-closeout.mjs",
    "packages/kernel/lib/m6-effect-boundary.mjs",
    "packages/kernel/lib/m6-live-evidence.mjs",
    "packages/kernel/lib/m6-live-grounding.mjs",
    "packages/kernel/lib/m6-screen-frame.mjs",
    "packages/kernel/lib/open-action.mjs",
    "packages/kernel/lib/skill-runtime.mjs",
    "packages/release/lib/release-identity.mjs",
    "packages/release/lib/release-manifest.mjs",
    "services/control-plane/apps/douyin/adapter.mjs",
    "services/control-plane/apps/douyin/capabilities.json",
    "services/control-plane/apps/vision/adapter.mjs",
    "services/control-plane/apps/vision/capabilities.json",
    "services/control-plane/apps/wechat/adapter.mjs",
    "services/control-plane/apps/wechat/capabilities.json",
    "services/control-plane/apps/xhs/adapter.mjs",
    "services/control-plane/apps/xhs/capabilities.json",
    "services/control-plane/apps/xhs/publish-edit-dry-run.mjs",
    "services/control-plane/apps/xhs/routine-comment-chain.mjs",
    "services/control-plane/apps/xhs/routine-draft-provider.mjs",
    "services/control-plane/apps/xhs/routine-effect-bridge.mjs",
    "services/control-plane/apps/xhs/routine-effect-transport.mjs",
    "services/control-plane/apps/xhs/social-verifiers.mjs",
    "services/control-plane/apps/xianyu/adapter.mjs",
    "services/control-plane/apps/xianyu/capabilities.json",
    "services/control-plane/apps/xiaowei/adapter.mjs",
    "services/control-plane/apps/xiaowei/capabilities.json",
    "services/control-plane/apps/xiaowei/explorer-primitive.mjs",
    "services/control-plane/apps/xiaowei/m6-grounded-tcb.mjs",
    "services/control-plane/apps/xiaowei/m6-target-environment-qualification.mjs",
    "services/control-plane/apps/xiaowei/read-observation.mjs",
    "services/control-plane/control-plane/bootstrap.mjs",
    "services/control-plane/control-plane/lib/authorization-decision.mjs",
    "services/control-plane/control-plane/lib/canonical.mjs",
    "services/control-plane/control-plane/lib/capability-effect.mjs",
    "services/control-plane/control-plane/lib/capability-registry.mjs",
    "services/control-plane/control-plane/lib/command-runner.mjs",
    "services/control-plane/control-plane/lib/control-plane.mjs",
    "services/control-plane/control-plane/lib/delegation-grant-policy.mjs",
    "services/control-plane/control-plane/lib/delegation-grant-runtime.mjs",
    "services/control-plane/control-plane/lib/device-run.mjs",
    "services/control-plane/control-plane/lib/discovery-session.mjs",
    "services/control-plane/control-plane/lib/effect-commit-protocol.mjs",
    "services/control-plane/control-plane/lib/effect-firewall.mjs",
    "services/control-plane/control-plane/lib/effect-ledger.mjs",
    "services/control-plane/control-plane/lib/errors.mjs",
    "services/control-plane/control-plane/lib/evidence-store.mjs",
    "services/control-plane/control-plane/lib/financial-commit-classifier.mjs",
    "services/control-plane/control-plane/lib/generated-overlay.mjs",
    "services/control-plane/control-plane/lib/implementation-closure.mjs",
    "services/control-plane/control-plane/lib/json-schema-validator.mjs",
    "services/control-plane/control-plane/lib/m6-c1-runtime-owner-lock.mjs",
    "services/control-plane/control-plane/lib/m6-device-read-snapshot.mjs",
    "services/control-plane/control-plane/lib/m6-frame-capture.mjs",
    "services/control-plane/control-plane/lib/m6-frame-evidence-store.mjs",
    "services/control-plane/control-plane/lib/m6-gate-f-operations.mjs",
    "services/control-plane/control-plane/lib/m6-gate-loader.mjs",
    "services/control-plane/control-plane/lib/m6-gate-promoter.mjs",
    "services/control-plane/control-plane/lib/m6-gate-safety-close-arm.mjs",
    "services/control-plane/control-plane/lib/m6-grounded-action-facade.mjs",
    "services/control-plane/control-plane/lib/m6-grounded-action-run-manager.mjs",
    "services/control-plane/control-plane/lib/m6-grounded-run-capability-seal.mjs",
    "services/control-plane/control-plane/lib/m6-grounded-run-tcb-closure.mjs",
    "services/control-plane/control-plane/lib/m6-issuer-allowlist.mjs",
    "services/control-plane/control-plane/lib/m6-live-broker.mjs",
    "services/control-plane/control-plane/lib/m6-live-entry.mjs",
    "services/control-plane/control-plane/lib/m6-live-fresh-state-capture.mjs",
    "services/control-plane/control-plane/lib/m6-live-gate-v2.mjs",
    "services/control-plane/control-plane/lib/m6-live-gate.mjs",
    "services/control-plane/control-plane/lib/m6-live-production-callbacks.mjs",
    "services/control-plane/control-plane/lib/m6-live-production-dependencies.mjs",
    "services/control-plane/control-plane/lib/m6-live-window-authorization.mjs",
    "services/control-plane/control-plane/lib/m6-qualification-bootstrap.mjs",
    "services/control-plane/control-plane/lib/m6-typed-transport.mjs",
    "services/control-plane/control-plane/lib/mission-policy.mjs",
    "services/control-plane/control-plane/lib/mission-runtime.mjs",
    "services/control-plane/control-plane/lib/nonpayment-autonomy-policy.mjs",
    "services/control-plane/control-plane/lib/open-action-executor.mjs",
    "services/control-plane/control-plane/lib/open-action-session.mjs",
    "services/control-plane/control-plane/lib/payment-firewall.mjs",
    "services/control-plane/control-plane/lib/placement.mjs",
    "services/control-plane/control-plane/lib/policy.mjs",
    "services/control-plane/control-plane/lib/protected-commit-policy.mjs",
    "services/control-plane/control-plane/lib/protected-human-commit.mjs",
    "services/control-plane/control-plane/lib/recipe-descriptor.mjs",
    "services/control-plane/control-plane/lib/recipe-interpreter.mjs",
    "services/control-plane/control-plane/lib/recipe-primitive-handlers.mjs",
    "services/control-plane/control-plane/lib/recovery-inspection.mjs",
    "services/control-plane/control-plane/lib/return-home.mjs",
    "services/control-plane/control-plane/lib/runtime-integrity.mjs",
    "services/control-plane/control-plane/lib/single-device-recipe-runner.mjs",
    "services/control-plane/control-plane/lib/state-store.mjs",
    "services/control-plane/control-plane/lib/tcb-manifest.mjs",
    "services/control-plane/control-plane/lib/transport-action-authorization.mjs",
    "services/control-plane/control-plane/lib/trusted-human-issuer.mjs",
    "services/control-plane/control-plane/lib/typed-transport.mjs",
    "services/control-plane/control-plane/lib/windows-private-acl.mjs",
    "services/control-plane/control-plane/lib/windows-system-tcb-acl.mjs",